15:50:58.724676 IP6 localhost.50894 > localhost.8013: Flags [S], seq 3880841, win 65535, options [mss 16324,nop,wscale 6,nop,nop,TS val 1466624168 ecr 0,sackOK,eol], length 0
15:50:58.724695 IP6 localhost.50894 > localhost.8013: Flags [S], seq 3880841, win 65535, options [mss 16324,nop,wscale 6,nop,nop,TS val 1466624168 ecr 0,sackOK,eol], length 0
15:50:58.724767 IP6 localhost.8013 > localhost.50894: Flags [S.], seq 3661233270, ack 3880842, win 65535, options [mss 16324,nop,wscale 6,nop,nop,TS val 2906182520 ecr 1466624168,sackOK,eol], length 0
15:50:58.724770 IP6 localhost.8013 > localhost.50894: Flags [S.], seq 3661233270, ack 3880842, win 65535, options [mss 16324,nop,wscale 6,nop,nop,TS val 2906182520 ecr 1466624168,sackOK,eol], length 0
15:50:58.724777 IP6 localhost.50894 > localhost.8013: Flags [.], ack 1, win 6371, options [nop,nop,TS val 1466624168 ecr 2906182520], length 0
15:50:58.724778 IP6 localhost.50894 > localhost.8013: Flags [.], ack 1, win 6371, options [nop,nop,TS val 1466624168 ecr 2906182520], length 0
15:50:58.724787 IP6 localhost.8013 > localhost.50894: Flags [.], ack 1, win 6371, options [nop,nop,TS val 2906182520 ecr 1466624168], length 0
15:50:58.724788 IP6 localhost.8013 > localhost.50894: Flags [.], ack 1, win 6371, options [nop,nop,TS val 2906182520 ecr 1466624168], length 0
15:50:58.725580 IP6 localhost.50894 > localhost.8013: Flags [P.], seq 1:83, ack 1, win 6371, options [nop,nop,TS val 1466624169 ecr 2906182520], length 82
15:50:58.725593 IP6 localhost.50894 > localhost.8013: Flags [P.], seq 1:83, ack 1, win 6371, options [nop,nop,TS val 1466624169 ecr 2906182520], length 82
15:50:58.725610 IP6 localhost.8013 > localhost.50894: Flags [.], ack 83, win 6370, options [nop,nop,TS val 2906182521 ecr 1466624169], length 0
15:50:58.725612 IP6 localhost.8013 > localhost.50894: Flags [.], ack 83, win 6370, options [nop,nop,TS val 2906182521 ecr 1466624169], length 0
15:50:58.725639 IP6 localhost.8013 > localhost.50894: Flags [P.], seq 1:47, ack 83, win 6370, options [nop,nop,TS val 2906182521 ecr 1466624169], length 46
15:50:58.725648 IP6 localhost.8013 > localhost.50894: Flags [P.], seq 1:47, ack 83, win 6370, options [nop,nop,TS val 2906182521 ecr 1466624169], length 46
15:50:58.725678 IP6 localhost.50894 > localhost.8013: Flags [.], ack 47, win 6371, options [nop,nop,TS val 1466624169 ecr 2906182521], length 0
15:50:58.725683 IP6 localhost.50894 > localhost.8013: Flags [.], ack 47, win 6371, options [nop,nop,TS val 1466624169 ecr 2906182521], length 0
15:50:58.725696 IP6 localhost.8013 > localhost.50894: Flags [P.], seq 47:56, ack 83, win 6370, options [nop,nop,TS val 2906182521 ecr 1466624169], length 9
15:50:58.725704 IP6 localhost.8013 > localhost.50894: Flags [P.], seq 47:56, ack 83, win 6370, options [nop,nop,TS val 2906182521 ecr 1466624169], length 9
15:50:58.725713 IP6 localhost.50894 > localhost.8013: Flags [.], ack 56, win 6371, options [nop,nop,TS val 1466624169 ecr 2906182521], length 0
15:50:58.725716 IP6 localhost.50894 > localhost.8013: Flags [.], ack 56, win 6371, options [nop,nop,TS val 1466624169 ecr 2906182521], length 0
15:50:58.726477 IP6 localhost.50894 > localhost.8013: Flags [P.], seq 83:372, ack 56, win 6371, options [nop,nop,TS val 1466624169 ecr 2906182521], length 289
15:50:58.726488 IP6 localhost.50894 > localhost.8013: Flags [P.], seq 83:372, ack 56, win 6371, options [nop,nop,TS val 1466624169 ecr 2906182521], length 289
15:50:58.726498 IP6 localhost.8013 > localhost.50894: Flags [.], ack 372, win 6366, options [nop,nop,TS val 2906182521 ecr 1466624169], length 0
15:50:58.726504 IP6 localhost.8013 > localhost.50894: Flags [.], ack 372, win 6366, options [nop,nop,TS val 2906182521 ecr 1466624169], length 0
15:50:58.727075 IP6 localhost.8013 > localhost.50894: Flags [P.], seq 56:73, ack 372, win 6366, options [nop,nop,TS val 2906182523 ecr 1466624169], length 17
15:50:58.727086 IP6 localhost.8013 > localhost.50894: Flags [P.], seq 56:73, ack 372, win 6366, options [nop,nop,TS val 2906182523 ecr 1466624169], length 17
15:50:58.727099 IP6 localhost.50894 > localhost.8013: Flags [.], ack 73, win 6370, options [nop,nop,TS val 1466624171 ecr 2906182523], length 0
15:50:58.727105 IP6 localhost.50894 > localhost.8013: Flags [.], ack 73, win 6370, options [nop,nop,TS val 1466624171 ecr 2906182523], length 0
15:50:58.727146 IP6 localhost.50894 > localhost.8013: Flags [P.], seq 372:389, ack 73, win 6370, options [nop,nop,TS val 1466624171 ecr 2906182523], length 17
15:50:58.727155 IP6 localhost.50894 > localhost.8013: Flags [P.], seq 372:389, ack 73, win 6370, options [nop,nop,TS val 1466624171 ecr 2906182523], length 17
15:50:58.727165 IP6 localhost.8013 > localhost.50894: Flags [.], ack 389, win 6365, options [nop,nop,TS val 2906182523 ecr 1466624171], length 0
15:50:58.727168 IP6 localhost.8013 > localhost.50894: Flags [.], ack 389, win 6365, options [nop,nop,TS val 2906182523 ecr 1466624171], length 0
15:50:58.728022 IP6 localhost.8013 > localhost.50894: Flags [P.], seq 73:251, ack 389, win 6365, options [nop,nop,TS val 2906182523 ecr 1466624171], length 178
15:50:58.728033 IP6 localhost.8013 > localhost.50894: Flags [P.], seq 73:251, ack 389, win 6365, options [nop,nop,TS val 2906182523 ecr 1466624171], length 178
15:50:58.728047 IP6 localhost.50894 > localhost.8013: Flags [.], ack 251, win 6367, options [nop,nop,TS val 1466624171 ecr 2906182523], length 0
15:50:58.728053 IP6 localhost.50894 > localhost.8013: Flags [.], ack 251, win 6367, options [nop,nop,TS val 1466624171 ecr 2906182523], length 0
15:50:58.731032 IP6 localhost.50894 > localhost.8013: Flags [P.], seq 389:406, ack 251, win 6367, options [nop,nop,TS val 1466624175 ecr 2906182523], length 17
15:50:58.731043 IP6 localhost.50894 > localhost.8013: Flags [P.], seq 389:406, ack 251, win 6367, options [nop,nop,TS val 1466624175 ecr 2906182523], length 17
15:50:58.731054 IP6 localhost.8013 > localhost.50894: Flags [.], ack 406, win 6365, options [nop,nop,TS val 2906182527 ecr 1466624175], length 0
15:50:58.731059 IP6 localhost.8013 > localhost.50894: Flags [.], ack 406, win 6365, options [nop,nop,TS val 2906182527 ecr 1466624175], length 0
15:50:58.731466 IP6 localhost.8013 > localhost.50894: Flags [P.], seq 251:268, ack 406, win 6365, options [nop,nop,TS val 2906182527 ecr 1466624175], length 17
15:50:58.731478 IP6 localhost.8013 > localhost.50894: Flags [P.], seq 251:268, ack 406, win 6365, options [nop,nop,TS val 2906182527 ecr 1466624175], length 17
15:50:58.731487 IP6 localhost.50894 > localhost.8013: Flags [.], ack 268, win 6367, options [nop,nop,TS val 1466624175 ecr 2906182527], length 0
15:50:58.731490 IP6 localhost.50894 > localhost.8013: Flags [.], ack 268, win 6367, options [nop,nop,TS val 1466624175 ecr 2906182527], length 0
15:51:04.000330 IP6 localhost.50894 > localhost.8013: Flags [P.], seq 406:531, ack 268, win 6367, options [nop,nop,TS val 1466629444 ecr 2906182527], length 125
15:51:04.000344 IP6 localhost.50894 > localhost.8013: Flags [P.], seq 406:531, ack 268, win 6367, options [nop,nop,TS val 1466629444 ecr 2906182527], length 125
15:51:04.000358 IP6 localhost.8013 > localhost.50894: Flags [.], ack 531, win 6363, options [nop,nop,TS val 2906187796 ecr 1466629444], length 0
15:51:04.000364 IP6 localhost.8013 > localhost.50894: Flags [.], ack 531, win 6363, options [nop,nop,TS val 2906187796 ecr 1466629444], length 0
15:51:04.000668 IP6 localhost.8013 > localhost.50894: Flags [P.], seq 268:285, ack 531, win 6363, options [nop,nop,TS val 2906187796 ecr 1466629444], length 17
15:51:04.000678 IP6 localhost.8013 > localhost.50894: Flags [P.], seq 268:285, ack 531, win 6363, options [nop,nop,TS val 2906187796 ecr 1466629444], length 17
15:51:04.000691 IP6 localhost.50894 > localhost.8013: Flags [.], ack 285, win 6367, options [nop,nop,TS val 1466629444 ecr 2906187796], length 0
15:51:04.000697 IP6 localhost.50894 > localhost.8013: Flags [.], ack 285, win 6367, options [nop,nop,TS val 1466629444 ecr 2906187796], length 0
15:51:04.001368 IP6 localhost.50894 > localhost.8013: Flags [P.], seq 531:548, ack 285, win 6367, options [nop,nop,TS val 1466629445 ecr 2906187796], length 17
15:51:04.001386 IP6 localhost.50894 > localhost.8013: Flags [P.], seq 531:548, ack 285, win 6367, options [nop,nop,TS val 1466629445 ecr 2906187796], length 17
15:51:04.001404 IP6 localhost.8013 > localhost.50894: Flags [.], ack 548, win 6363, options [nop,nop,TS val 2906187797 ecr 1466629445], length 0
15:51:04.001411 IP6 localhost.8013 > localhost.50894: Flags [.], ack 548, win 6363, options [nop,nop,TS val 2906187797 ecr 1466629445], length 0
15:51:04.002067 IP6 localhost.8013 > localhost.50894: Flags [P.], seq 285:343, ack 548, win 6363, options [nop,nop,TS val 2906187797 ecr 1466629445], length 58
15:51:04.002084 IP6 localhost.8013 > localhost.50894: Flags [P.], seq 285:343, ack 548, win 6363, options [nop,nop,TS val 2906187797 ecr 1466629445], length 58
15:51:04.002099 IP6 localhost.50894 > localhost.8013: Flags [.], ack 343, win 6366, options [nop,nop,TS val 1466629445 ecr 2906187797], length 0
15:51:04.002106 IP6 localhost.50894 > localhost.8013: Flags [.], ack 343, win 6366, options [nop,nop,TS val 1466629445 ecr 2906187797], length 0
15:51:04.002410 IP6 localhost.50894 > localhost.8013: Flags [P.], seq 548:565, ack 343, win 6366, options [nop,nop,TS val 1466629446 ecr 2906187797], length 17
15:51:04.002421 IP6 localhost.50894 > localhost.8013: Flags [P.], seq 548:565, ack 343, win 6366, options [nop,nop,TS val 1466629446 ecr 2906187797], length 17
15:51:04.002431 IP6 localhost.8013 > localhost.50894: Flags [.], ack 565, win 6363, options [nop,nop,TS val 2906187798 ecr 1466629446], length 0
15:51:04.002436 IP6 localhost.8013 > localhost.50894: Flags [.], ack 565, win 6363, options [nop,nop,TS val 2906187798 ecr 1466629446], length 0
15:51:04.002979 IP6 localhost.8013 > localhost.50894: Flags [P.], seq 343:360, ack 565, win 6363, options [nop,nop,TS val 2906187798 ecr 1466629446], length 17
15:51:04.002993 IP6 localhost.8013 > localhost.50894: Flags [P.], seq 343:360, ack 565, win 6363, options [nop,nop,TS val 2906187798 ecr 1466629446], length 17
15:51:04.003007 IP6 localhost.50894 > localhost.8013: Flags [.], ack 360, win 6366, options [nop,nop,TS val 1466629446 ecr 2906187798], length 0
15:51:04.003010 IP6 localhost.50894 > localhost.8013: Flags [.], ack 360, win 6366, options [nop,nop,TS val 1466629446 ecr 2906187798], length 0
15:51:16.103660 IP6 localhost.50894 > localhost.8013: Flags [F.], seq 565, ack 360, win 6366, options [nop,nop,TS val 1466641547 ecr 2906187798], length 0
15:51:16.103673 IP6 localhost.50894 > localhost.8013: Flags [F.], seq 565, ack 360, win 6366, options [nop,nop,TS val 1466641547 ecr 2906187798], length 0
15:51:16.103696 IP6 localhost.8013 > localhost.50894: Flags [.], ack 566, win 6363, options [nop,nop,TS val 2906199899 ecr 1466641547], length 0
15:51:16.103700 IP6 localhost.8013 > localhost.50894: Flags [.], ack 566, win 6363, options [nop,nop,TS val 2906199899 ecr 1466641547], length 0
15:51:16.105633 IP6 localhost.8013 > localhost.50894: Flags [F.], seq 360, ack 566, win 6363, options [nop,nop,TS val 2906199901 ecr 1466641547], length 0
15:51:16.105645 IP6 localhost.8013 > localhost.50894: Flags [F.], seq 360, ack 566, win 6363, options [nop,nop,TS val 2906199901 ecr 1466641547], length 0
15:51:16.105672 IP6 localhost.50894 > localhost.8013: Flags [.], ack 361, win 6366, options [nop,nop,TS val 1466641549 ecr 2906199901], length 0
15:51:16.105675 IP6 localhost.50894 > localhost.8013: Flags [.], ack 361, win 6366, options [nop,nop,TS val 1466641549 ecr 2906199901], length 0
